{
  "title": "Demo kind lab",
  "description": "democert 1.2: break/fix lab, beginner",
  "details": {
    "intro": {
      "text": "intro.md",
      "foreground": "foreground.sh",
      "background": "background.sh"
    },
    "steps": [
      {
        "title": "Read the symptom",
        "text": "step1.md"
      },
      {
        "title": "Fix it",
        "text": "step2.md",
        "verify": "verify.sh"
      }
    ],
    "finish": {
      "text": "finish.md"
    },
    "assets": {
      "host01": [
        {
          "file": "break_fix.sh",
          "target": "/root"
        }
      ]
    }
  },
  "backend": {
    "imageid": "kubernetes-kubeadm-1node"
  }
}
